Kati,4.0,3.5,3.5,"Capain: Crit Bonus too low; Officer: Base attacks only, works best with Cpt Khan's criticals",Kati,,,,CM: Increase Critical Hit Chances against Defence Platforms OA: Increase Critical Hit Damage in Station Combat
Keenser,5.0,4.5,4.5,Captain & Officer; station only;  one of the best blue Defense stats if maxed,Keenser,,,,CM: Increase Hull Health as long as ship is in the station OA: Increase Shield Health as long as ship is in the station
Kerla,2.0,2.5,2.0,Captain: useless!;  Officer: crit Bonus gets further boosted by Hull Breach,Kerla,,,,CM: Increase Dodge when the Shields are deleted OA: Increase Critical Damage with Kinetic Weapons
Khan,1.0,1.0,1.0,Captain: BEST Base attack captain; Officer: best critical chance bonus in game,Khan,,,,CM: Chance to dramatically Decrease opponent's station and ship mitigation for 2 rounds OA: Increase Critical Chances every time the ship gets hit
Kira Nerys,2.5,2.5,2.5,Below Decks: Reduces opponent player's Critical Hit Chance; Officer: Decreses Assault target shield deflection,Kira Nerys,,,,BDA: Reduce opponent player Critical Hit Chance OA: Decreases Shield Mitigation by
Kirk,1.0,1.0,1.0,Captain: can generate Temporary Hit points; Officer: BEST morale source in game,Kirk,Morale,Y,Y,CM: Increase all officer stats when the ship has Morale OA: Chance to inspire Morale to his ship for 2 rounds
Klaa,1.5,4.0,2.5,Captain: best solo officer speed source!; Officer: critical Damage increase against EVERYTHING,Klaa,,,,CM: Increase Impulse Speed OA: Increase Critical Hit Damage
Komal,4.5,5.0,4.5,"Captain & Officer: PvP only, very weak effects",Komal,,,,CM: Increase Weapon Damage of Battleships against players OA: Decrease Kinetic Weapon Damage from enemy players
Koth,4.5,4.5,4.5,Captain: very small dmg bonus; Officer: don´t bother too much effort for a tiny dmg bonus,Koth,Breach,,Y,CM: Increase Repair speed on this ship if it is an Interceptor OA: Increase Kinetic damage while opponent has Hull Breach
Kras,4.0,3.0,3.5,"Captain & Officer: PvP only, very weak effects, very good ""Lower Deck"" Officer",Kras,,,,CM: Decrease opponents Captain's Maneuver effectiveness OA: Decrease all the stats of the opponents Bridge Officers
Krell,3.5,2.5,3.0,Captain: do not bother; Officer: need to max,Krell,,,,CM: Chance to causing Hull Breach for 1 round when receiving Shield Damage OA: Increase Damage to Federation ships by % of crew's Defence
Kumak,2.0,2.5,2.0,"Captain: increases Attack, Defense, Health stats during Combat  - so many uses!; Officer: do not bother",Kumak,Burning,,Y,CM: Increase Officer Stats each round OA: Increase mitigation when opponent is burning
Kuron,2.0,2.0,2.0,"Captain: Tooltip completly wrong ""after winning battle"" not just ""after destroying a ship""- High Damage possibilies; Officer: high Impulse bonus",Kuron,,,,CM: Chance to automatically recharge first kinetic hit OA: Increase Impulse speed after destroying a ship
L'Nar,4.0,3.0,3.5,Captain: do not bother; Officer: need to max,L'Nar,,,,CM: Increase Health of Bridge Officers OA: Increase Damage Against Klingon ships by % of crew's Attack
Laliari,0.0,0.0,0.0,Below Deck: Increases the Apex Barrier when in Wave Defence ; Officer: Decreases the cooldown of the NSEA Protectors Omega-13 Ability,Laliari,,,,BDA: Increases the Apex Barrier when in Wave Defense OA: Decreases the cooldown of the NSEA Protectors Omega-13 Ability
Leslie,2.0,4.0,3.0,"Hard to get! - Captain ability useful against Eclipse Armadas, can keep you alive for 100 Rounds",Leslie,,,,CM: Restore Hull Health when under 35% of starting value OA: Increase Ship XP on Battleships
Lieutenant Picard,0.0,0.0,0.0,Lieutenant Picard,Lieutenant Picard,,,,CM: Increases Apex Barrier against non-Armada hostiles of level 35 and under OA: Increases Shield Health vs non-Armada hostiles
Linkasa,4.5,4.5,4.5,Do not bother with this officer,Linkasa,,,,CM: Increase Officers Defence for 1 min after winning OA: Increase Armor by % of total Attack at the start of combat
Livis,2.5,3.0,2.5,Captain: nope; Officer: good hull increase;  One of the highest possible (blue Officer) stats for Health,Livis,,,,CM: Increase repair speed on this ship if it is a Battleship OA: Increase ship's max Hull Health if it is a Battleship
Lorca,1.0,1.5,1.0,"Captain: PvP only - decent dmg reduction; Officer: best possible ""Hull Breach"" source - recommend Rank 3",Lorca,Breach,Y,Y,CM: Decrease opponents damge if they have Hull Breach OA: Chance to inflict Hull Breach
Lursa,5.0,5.0,5.0,Captain: Decrease Cloaking cooldown; Officer: Decreases player opponent's damage by a small amount to base.,Lursa,,,,"CM: When on a ship that can use cloaking, Lursa decreases the cloaking cooldown OA: When attacking other players, Lursa decreases the opponent's Weapon Damage"
M'Benga,5.0,5.0,5.0,Do not bother with this officer,M'Benga,,,,"CM: Increase Armor Piercing, Shield Piercing and Accuracy when defending the Station OA: Increase Mitigation when defending the Station"
M'Ral,4.5,5.0,4.5,Captain: only small Armor Piercing bonus; Officer: officer base attack value boost (** Broken Bridge Only**),M'Ral,,,,CM: Increase Armor Piercing OA: Increase Attack of crew (**Broken Bridge Only**)
Mäkinen,2.0,2.5,2.0,Captain: 10% to 50% mining speed increase for everything is always useful; Officer: Iso-mining only,Mäkinen,,,,CM: Increase Mining Speed (All) OA: Increase Mining Speed (Isogen)
Mara,3.0,2.5,2.5,Captain: do not bother; Officer: loses ALOT of effiency in PvP,Mara,Breach,,Y,CM: Increase Damage against Interceptors OA: Decrease opponent's dodge every round when it has Hull Breach
Marcus,2.5,1.5,2.0,Captain: can be hard to activate him; Officer: get the Officer to Rank 3 before you use him,Marcus,Morale,Y,,CM: Chance to inspire morale when opponent's HHP is under 80% OA: Increase Shield piercing by crew's Defence
Marla,3.0,3.5,3.0,Do not bother with this officer,Marla,,,,CM: Increase Ships repair speed OA: Increase ships Captain's stats
Martok,4.0,2.5,3.0,"Captain: Small increase to Kinetic weapon damage; Officer: Anti Trinity officer to counter Accuracy, increases Dodge based on officer defense.",Martok,,,,CM: Increase Kinetic Weapon Damage OA: Increase ship's Dodge by Defence of crew
Mavery,2.0,2.5,2.0,"Captain: Increase max cargo; Officer: Increase Crystal, Gas and Ore mining speed.",Mavery,,,,"CM: Increase Max Cargo OA: Increase Crystal, Gas and Ore mining speed"
Michael Burnham,2.0,2.5,2.0,"Captain: speed boost; Officer: get Rank 5; Ship Firing Pattern is important , feed alot of Attack 30.000+",Michael Burnham,,,,CM: Increase Impulse Speed OA: Decrease opponent's SHP by % Crew's Attack
Miles O'Brien,1.0,1.0,1.0,Below Decks: Increase base warp speed; Officer: Chance to double shots against armadas for 3 rounds,Miles O'Brien,,,,"BDA: Increases Warp Speed OA: At the start of each round, chance to double shots against armadas for 3 rounds."
Mirek,3.5,2.5,3.0,Captain: one Round Burning; Officer: max the officer,Mirek,Burning,Y,,CM: Chance to cause burning for 1 round when ship is hit OA: Increase Damage against Federation by % of crew's Defence
Mirror Data,1.0,1.0,1.0,Captain: Increases Apex Barrier against a player Interceptor; Office: Chance to apply Assimilate for 2 rounds when fighting a player.,Mirror Data,Assimilate,Y,,"CM: On combat start against player Interceptor, increases Apex Barrier OA: On round start, chance to apply Assimilate for 2 rounds"
Mirror Ezri,0.0,0.0,0.0,"Captain: Increases Apex Barrier against a player Battleship; Officer: At start of round, if player is assimilated, increase Kinetic damage for 1 round",Mirror Ezri,Assimilate,,Y,"CM: On combat start against player Battleships increases Apex Barrier OA: On round start against players with Assimilate, increases Kinetic weapon damage for 1 round"
Mirror Kira,0.0,0.0,0.0,"Captain: At the start of each round, against a player, increases Apex Barrier for 5 rounds; Officer: At start of round, if player is assimilated, increases shots for 5 rounds",Mirror Kira,Assimilate,,Y,"CM: On round start against players, increases Apex Barrier for 5 rounds (cumulative) OA: On round start against players with Assimilate, increases shots for 5 rounds (cumulative)"
Mirror Picard,1.0,1.0,1.0,Captain: Increases Isolytic Cascade against players; Officer: Increases Apex Barrier against players,Mirror Picard,Assimilate,,Y,"CM: On round start against players, increases Isolytic Cascade OA: On round start against players with Assimilate, increases Apex Barrier"
Mirror Troi,0.0,0.0,0.0,"Captain: Increases Apex Barrier against a player Explorer; Officer: At start of round, if player is assimilated, increase Energy damage for 1 round",Mirror Troi,Assimilate,,Y,"CM: On combat start against player Explorers increases Apex Barrier OA: On round start against players with Assimilate, increases Energy weapon damage for 1 round"
Mitchell,3.5,3.0,3.0,Captain: **Buggy** - affects only Bridge Crew; Officer: Terrible any Dmg bonus resets each round,Mitchell,,,,CM: Increasae all officer stats on board when defending a station OA: Increase Damage for 1 round when hit by a critical
Moreau,1.0,2.0,1.5,Captain: good shield glitch - any fight doubles your shield capacity; Officer:  increase your defense mitigation,Moreau,,,,CM: % Shield healed after winning OA: Decrease hostile penetration
Mudd,3.5,3.5,3.5,Captain: terrible Armada damage reduction  ;  Officer: only usefull with a maxed Eurydice,Mudd,,,,CM: Decrease Armada Target Weapon Damage when taking damage OA: Increase damage when shields are depleted
Naga Delvos,0.0,0.0,0.0,Captain: Increases the Cost Efficiency of the Borg Cube's Transwarp Jump; Below Deck: Increases base repair cost efficiency of the ship; Officer: Increases the base damage of the Borg Cube's Cutting Beam against players,Naga Delvos,,,,BDA: Increases base repair cost efficiency of the ship OA: Increases the base damage of the Borg Cube's Cutting Beam against players
Navi,4.0,4.0,4.0,Do not bother with this officer,Navi,Breach,,Y,CM: Increase Critical Damage when own ship has Hull Breach OA: Increase mitigation when own ship has hull breach
Neelix,3.0,1.0,2.0,Below Decks: Chance each round to apply Burning to non-Player hostiles or Armada (Does not work with Tal); Officer: Increases Voyager's ship ability efficiency.,Neelix,Burning,Y,,"BDA: Chance to cause Burning versus non-player hostiles and Armadas, does not trigger with Tal on the bridge. OA: Increases Cost Efficiency of Voyager's active ship ability"
Nero,3.0,2.0,2.5,"Captain: you never use it; Officer: Burning Source, every other round  - very good Health stats",Nero,Burning,Y,Y,CM: Increase Damage when opponent's ship is Burning OA: Chance to cause Burning when hitting enemy
Nesmith,0.0,0.0,0.0,Captain: Decreases Invading Entities Shield Mitigation; Officer: Increases your Apex Barrier when fighting hostiles,Nesmith,,,,CM: Decreases Invading Entities Shield Mitigation OA: Increases your Apex Barrier when fighting hostiles
Next Gen Crusher,1.5,1.0,1.0,Same as Cadet McCoy,Next Gen Crusher,,,,CM: Increase Health of all Officers on the ship OA: Increase Captains Maneuver
Next Gen Data,2.0,1.5,1.5,Same as Cadet Kirk,Next Gen Data,,,,CM: Increase all Officer stats on Bridge OA: Increase Weapon Damage
Next Gen La Forge,1.0,1.0,1.0,Same as Cadet Uhura,Next Gen La Forge,,,,CM: Decrease opponents Weapon Damage OA: Increase Shield Health
Next Gen Riker,4.5,5.0,4.5,Same as Cadet Sulu,Next Gen Riker,,,,CM: Increase Damage for first round OA: Increase Attack of all Officers on the ship (** Broken Bridge ONLY **)
Next Gen Troi,3.5,3.5,3.5,Same as Instructor Spock,Next Gen Troi,,,,CM: Increase Damage OA: Increase Mitigation
Nine Of Eleven,2.5,3.5,3.0,"Captain: vs. Borg only; Powerful ""Defense stat boost""",Nine Of Eleven,,,,CM: Decrease Borg critical hit chance OA: Increase Defence of all Officers on the ship
Odo,2.0,2.5,2.0,"Below Deck: Increase Critical Damage against Solo Armadas; Officer: Increase Armor, Shield Deflection and Dodge against Solo Armadas",Odo,,,,"BDA: Increase Critical Hit Damage OA: Increases base Armor, Shield Deflection and Dodge against solo armadas"
One Of Eleven,3.0,3.0,3.0,Officer: Protected Cargo buff,One Of Eleven,,,,CM: Increate Shield Mitigation OA: Increase Protected Cargo
Origins Burnham,5.0,5.0,5.0,Do not bother with this officer,Origins Burnham,,,,CM: Increase All Officers Attack OA: Increase Damage
Origins Saru,5.0,5.0,5.0,Do not bother with this officer,Origins Saru,,,,CM: Increase All Officers Base Defence OA: Increase Hull Health
Origins Stamets,5.0,5.0,5.0,Do not bother with this officer,Origins Stamets,,,,CM: Increase All Officers Base Health OA: Increase Warp Speed
Otto,4.5,4.0,4.0,Do not bother with this officer,Otto,,,,CM: Increase damage to defence platforms OA: Increase Attack of all officers on the bridge
Pan,2.0,4.0,3.0,Captain: Speed Officer with very good Synergy; Officer: terrible ability,Pan,Breach,Y,,CM: Increase Impulse Speed OA: Chance to apply Hull Breach on your own ship
Paul Stamets,2.0,3.0,2.5,Captain: Discovery only ability; Officer: terrible useless,Paul Stamets,,,,CM: Increase Jump and Summoning Cost Efficiency OA: Decrease opponent's Armor Piercing when defending from a player
Phlox,1.0,1.0,1.0,"Below Deck: Increases the efficiency of charging the Borg Cube's Cutting Beam; Officer: On combat start, reduces the opponent's Critical Hit Chance",Phlox,,,,"BDA: Increases the efficiency of charging the Borg Cube's Cutting Beam OA: On combat start, reduces the opponent's Critical Hit Chance for 8 rounds"
PIC Admiral Picard,3.5,3.5,3.5,Captain: Very good chance of placing Morale for 3 rounds; Officer: Large increase in damage when fighting Explorers,PIC Admiral Picard,Morale,Y,,"CM: At the start of round, chance to apply Morale for 3 rounds against player ships OA: Increases Weapon Damage on combat start against player Explorer for the duration of combat"
PIC Beverly Crusher,1.5,1.5,1.5,Below Decks: Increases borken parts dropped by hostiles; Officer: Increases crit damge every time you are hit. Increase stacks.,PIC Beverly Crusher,,,,"BDA: Increases the amount of Broken Ship Parts from hostiles OA: Everytime ship is hit by a weapon, increases Critical Damage (Stacks)"
PIC Hugh,2.5,2.0,2.0,"Below Decks: At the beginning of each round of combat Hugh repairs a percentage of the hull health damage taken in the previous round; Officer: Increase the amount of raw Ore, Crystal and Gas collected while mining with any ship",PIC Hugh,,,,"BDA: At the beginning of each round of combat, repairs % of hull damage taken in the previous round of combat. OA: Increases the amount of Raw Ore, Crystal and Gas collected while mining with any ship, without draining the mining node faster."
PIC Riker,3.0,3.5,3.0,Captain: Very good chance of placing Burning for 3 rounds; Officer: Large increase in damage when fighting Battleships,PIC Riker,Burning,Y,,"CM: At the start of round, chance to apply Burning for 3 rounds against player ships OA: Increases Weapon Damage on combat start against player Battleships for the duration of combat"
PIC Worf,3.0,3.5,3.0,Captain: Very good chance of placing Hull Breach for 3 rounds; Officer: Large increase in damage when fighting Interceptors,PIC Worf,Breach,Y,,"CM: At the start of round, chance to apply Hull Breach for 3 rounds against player ships OA: Increases Weapon Damage on combat start against player Interceptors for the duration of combat"
Pike,1.0,2.0,1.5,"Captain: ONLY Combat abilities , you can do ALOT with him ; most popular for Cpt. Pike + Moreau + Chen",Pike,,,,CM: Increase the effectiveness of all Officer Abilities that trigger in combat OA: Increase Ship XP earned
Pon,1.0,2.0,1.5,Captain: Change to delat opponents weapons by 3 rounds in PvP when on Explorer; Significant increase to Crit Chance for 3 rounds in PvP when on an Explorer,Pon,Morale,,Y,"CM: A chance, at the start of combat, to delay the opponents weapons for 3 rounds, while fighting players, and on an Explorer OA: Decreases opponent player's Critical Chance at the start of each round, for 3 rounds if on an Explorer with Morale"
Qa'Ug,4.5,4.0,4.0,Do not bother with this officer,Qa'Ug,Breach,,Y,CM: Decrease opponent's officer stats if own ship recieves a Hull Breach OA: Increase accuracy when own ship has Hull Breach
Quark,1.0,1.5,1.0,"Captain: Good Protected Cargo; Officer: Good mining booster, similar to 10 of 11.",Quark,,,,CM: Increase Protected Cargo OA: Increase Mining Speed
Reginald Barclay,2.5,3.0,2.5,Below Decks: Increases protected cargo; Officer: Increase base defense of all officers by a small percentage,Reginald Barclay,,,,BDA: Increases the ship's base Protected Cargo OA: Increases the base Defense of all Officers
Rima,5.0,4.5,4.5,Do not bother with this officer,Rima,Breach,,Y,CM: Increase damage when own ship has hull breach. OA: Increase Critical Hit chances when own ship hass Hull Breach
Ro Mudd,4.5,4.0,4.0,Captain: useless; Officer: you really should max her to get the 60% chance to activate,Ro Mudd,,,,CM: Increase Captains Stats OA: Chance to increase damage by 300% of Officer Attack
Rom,1.0,1.5,1.0,"Captain: During base attacks, delays ALL opponents weapons by 1 round; Officer: Increased the number of all shots for whole battle",Rom,,,,"CM: When attacking a station, delays ship and pltatform weapons by 1 round OA: When attacking a station, increases number of shots of weapons"
Rukor,5.0,5.0,5.0,Do not bother with this officer,Rukor,,,,CM: Increase damage against players when in an Explorer OA: Increase Energy Weapon Damage against other ships
Sam Rutherford,1.5,2.0,1.5,Below Decks: Increase Shield Health; Officer: Small increase to mitigation,Sam Rutherford,,,,"BDA: Increase ship's Health OA: Increases Armor, Shield Deflection and Dodge"
Saru,1.0,2.0,1.5,"Captain & Officer; PvP only, can kill criticals against you. Damage reduction is very small",Saru,,,,CM: Decrease opponents Critical Hit Chance when receiving a critical hit OA: Decrease Opponent's Weapon damage
Scotty,5.0,5.0,5.0,Do not bother with this officer,Scotty,,,,CM: Increase Ships repair speed OA: Increase ship's Hull Health
Sela,2.0,2.0,2.0,Captain: Boost to critical when cloaked; Officer: Reduces opponent player's crit chance with every hit. Great anti Khan or Hon. Worf,Sela,,,,CM: Increase Critical Hit Damage while cloaked OA: Decrease enemy player's Critical Hit Chance every time the ship scores a hit
Sesha,5.0,4.0,4.5,"Captain: good effect, but hard to trigger; Officer: if maxed +90% critical damage is pretty usefull against Ecplise",Sesha,,,,CM: Decrease Eclipse hostile's Critical Hit Chance by 15% OA: Increase Critical Hit Damage aginst Eclipse Hostiles
Seven Of Eleven,2.0,2.0,2.0,"Captain: vs. Borg Probes only - very powerful, recommended on Vidar Tier 7 + top weapon upgrade",Seven Of Eleven,,,,CM: Chance to add 2 shots to each weapon when fighting Borg OA: Increase Health of all Officers on the ship
Seven Of Nine,1.0,1.0,1.0,Below Decks: Increases Isolitic Cascade damage against players; Officer: Increase Critical Damage against Armadas,Seven Of Nine,,,,BDA: Increases you ship's Isolytic Cascade againt players OA: Increases Critical Hit Damage versus Armadas
Severus,4.5,4.5,4.5,"Captain & Officer; needs your own ship to ""Burn"", almost never happens - Captain Bug , PvP opponent respawns",Severus,Burning,,Y,CM: Decrease opponent's Hull Health each round if own ship is burning OA: Increase Damage if own ship is burning
Shaxs,1.0,1.0,1.0,"Below Decks: On round start, Increases iso defence against players if on an Explorer with Morale; Officer: On round start, if on battleship and enemy player is burning, increase iso cascade for 1 round.",Shaxs,Burning,,Y,"BDA: On round start, if on Explorer with Morale, increases Isolytic Defense against players OA: On round start, if on Battleship and enemy player is burning, Increases Isolytic Cascade"
Shev,5.0,5.0,5.0,Captain: small tritanium loot increase; Officer: small Damage buff,Shev,,,,CM: Increase Tritanium rewards from Hostiles OA: Increase Energy Damage against Hostiles
Shran,3.5,3.5,3.5,Below Deck: Increases Crystal mining speed; Officer: Increases Warp Speed,Shran,,,,BDA: Increases Crystal Mining Speed OA: Increases base Warp Speed
Six Of Eleven,2.5,3.0,2.5,Captain: useless; Officer: good vs Armadas - needs good attack stats,Six Of Eleven,,,,CM: Decrease opponent SHP when hitting by Defence OA: Increase Penetration to Armadas by Attack
SNW Hemmer,2.0,2.0,2.0,Below Decks: Increases Health of all officers; Officer: **Changed** Great increase in mitigation against Survey hostiles,SNW Hemmer,,,,"BDA: Increases the Health of all officers on the ship OA: Increases  Armor, Shield Deflection and Dodge when in combat with Survey ships."
SNW James Kirk,1.0,1.0,1.0,Captain: Reduces Shield mitigation against non-armada hostiles; Officer: Increases Weapon Damage against non-armada hostiles.,SNW James Kirk,,,,CM: Reduces enemy Shield Mitigation vs non-Armada Hostiles OA: Increases base Weapon Damage vs non-Armada Hostiles
SNW La'an,1.5,1.0,1.0,Below Decks: Increase ship's base max cargo; Officer; Increase Warp Speed,SNW La'an,,,,BDA: SNW La'an increases the ship's base Max Cargo by OA: Increases base Warp Speed
SNW M'Benga,1.0,1.0,1.0,Captain: Increases mitigsation by a percentage of Health against non-armafa hostiles; Officer: Increases shield hit points every round against non-armada targets,SNW M'Benga,,,,CM: Increases all mitigation stats by % of Health vs non-Armada Hostiles OA: Increases SHP every round vs non-Armada Hostiles
SNW Nurse Chapel,1.0,1.0,1.0,"Below Decks: At start of combat, increases Isolitic cascade versus non-armada hostiles ;Officer: Increases Volatile Isomatter from Gorn hostiles",SNW Nurse Chapel,,,,"BDA: At the start of combat, Increases Isolytic Cascade damage vs non-armada Hostiles OA: Increases amount of Volatile Isomatter you get from destroying Gorn Hunters"
SNW Ortegas,1.0,1.0,1.0,Captain: Increases critical hit chance against hostiles; Officer: Great increase in mitigation against Explorers hostiles when in an Battleship,SNW Ortegas,,,,"CM: When fighting hostiles, SNW Ortegas increases critical hit chance against hostiles OA: Increases Armor, Shield Deflection, and Dodge by % of total Defense when attacking hostile Explorers from a Battleship"
SNW Pelia,2.0,1.0,1.5,Below Deck: Increases Isolytic Defence; Officer: Reduces Isolytic Damage from non-armada Hostiles,SNW Pelia,,,,BDA: Increases Isolytic Defence OA: Reduces Isolytic Damage received from non-Armada hostiles
SNW Pike,1.0,1.0,1.0,Captain: Increase shield mitigation when fighting hostiles; Officer: Decreases hostile shield mitigation,SNW Pike,,,,"CM: When fighting hostiles, increases Shield Mitigation OA: When fighting hostiles, decreases hostile Shield Mitigation"
SNW Sam Kirk,1.0,1.0,1.0,Captain: Reduceds enemy Shield Hitpoints against non-armada hostiles; Officer: Increases Critical Damage against non-armada hostiles,SNW Sam Kirk,,,,CM: Reduces enemy SHP every round vs non-Armada Hostiles OA: Increases Critical Damage every round vs non-Armada Hostiles
SNW Spock,1.5,1.0,1.0,Captain: Decrease critical hit chance of hostiles; Officer: Great increase in mitigation against Interceptor hostiles when in an Explorer,SNW Spock,,,,"CM: When fighting hostiles, SNW Spock decreases hostile critical hit chance OA: Increases Armor, Shield Deflection, and Dodge by % of total Defense when attacking hostile Interceptors from an Explorer"
SNW Uhura,1.0,1.0,1.0,Captain: Increases critical hit damage against hostiles; Officer: Great increase in mitigation against Battleship hostiles when in an Interceptor,SNW Uhura,,,,"CM: When fighting hostiles, SNW Uhura increases critical hit damage OA: Increases Armor, Shield Deflection, and Dodge by % of total Defense when attacking hostile Battleships from an Interceptor"
SNW Una,3.5,4.0,3.5,"Captain: When fighting hostiles, increase base weapon damage; Officer: Increase impulse speed",SNW Una,,,,"CM: When fighting hostiles, SNW Una increases base Weapon Damage OA: Increase Impulse speed"
Spock,2.0,1.0,1.5,"Captain: small Base Accuracy increase each round; Officer: should be atleast Rank 3,  needs ALOT of Defense",Spock,Morale,,Y,CM: Increase Accuracy at the start of each round OA: Restore Shield by % of crew's Defence when having Morale
Stonn,1.5,1.5,1.5,Officer: only officer that can increase the total Cargo Hold,Stonn,,,,CM: Increase Mining Speed (Ore) OA: Increase Cargo size
Strike Team La'an,1.0,2.0,1.5,Captain: Increases number of shots on battleship when fighting burning target; Officer: Inflicts burning when hitting with a battleship,Strike Team La'an,Burning,Y,Y,"CM: While on Battleship in PvP, if opponent is burning, at the start of each round, increase number of shots OA: While on Battleship in PvP each time ship hits with a weapon % chance of burning for 3 rounds"
Strike Team Ortegas,1.0,1.5,1.0,Captain: Inflicts burning when shot by an explorer; Officer: Chance to delay opponets shot in PvP,Strike Team Ortegas,Burning,Y,,"CM: When shot by a player Explorer, % chance of burning them fo r3 rounds OA: While on Battleship in PvP % chance of delaying opponents weapons by 1 round on their next attack."
Strike Team Una,1.0,1.5,1.0,Captain: Increases all officer stats when fighting player explorers; Officer: Decreases opponents shield mitigation in PvP when on a battleship.,Strike Team Una,,,,"CM: While in combat with player Explorer, increase all officer stats OA: While on Battleship in PvP Decreases Shield Mitigation each round"
Sulu,5.0,5.0,5.0,Captain: unreliable Morale source; Officer: only small energy damage increase,Sulu,Morale,Y,Y,CM: Chance to inspire Morale when being hit by a critical hit OA: Increase Energy Damage when ship has Morale
T'Laan,1.0,1.0,1.0,Officer: Kinetic Dmg reduction (Interceptor & Battleships) - Combo:  Cpt. Pike + Moreau + T'laan (max),T'Laan,,,,CM: Increase Ship XP from battles OA: Decrease Kinetic Damage dealt by Hostiles
