T'Pol,4.0,4.0,4.0,Below Decks: Increases Ore mining rate; Officer: Increases protected cargo,T'Pol,,,,BDA: Increase Ore Mining speed OA: Increases Protected Cargo
T'Pring,1.0,1.0,1.0,Officer: best Protected Cargo boost in game,T'Pring,,,,CM: Increase Mining Speed (Gas) OA: Increase Protected Cargo
Tal,1.0,1.0,1.0,"Captain: tiny dmg buff ; Officer: remove hull, when your opponent Is burning",Tal,Burning,,Y,CM: Increase damage against Battleships OA: Decrease the opponents Hull Health each turn while it is burning
Tasha Yar,3.0,3.0,3.0,"Captain: Eliminates critical chance on yellow bosses; Officer: Increases damage, might be good with Picard/Bev combo.",Tasha Yar,,,,CM: Reduces the Crit Chance of Mission Hostiles (yellow hostiles) OA: Increases all Weapon Damage against non-player targets
Ten Of Eleven,1.0,1.5,1.0,Universal mining officer - must have!,Ten Of Eleven,,,,"CM: Increase Mining Speed (Par, Trit, Dil) OA: Increase Mining Speed (All)"
The Doctor,1.0,1.0,1.0,"Below Decks: Increases resources dropped by hostiles, including rep; Officer Ability: Increases mitigation when hit by non-player target including armadas.",The Doctor,,,,"BDA: Increases all resources dropped by hostiles OA: When taking hull damage from non-player or Armada, Increases Armor, Shield Deflection and Dodge by % of Health for 2 rounds"
Three Of Eleven,1.0,1.0,1.0,Captain: Better version of T'Pring's Gas bonus; Officer: At rank 1 already better than a maxed T'Pring.,Three Of Eleven,,,,CM: Increases Gas mining speed OA: Increases Protected Cargo
Tilly,4.0,3.5,3.5,Captain: bad one time shield effect; Officer: To be useful - this ability has to trigger 20 to 40 times,Tilly,,,,CM: Decrease opponent's Sheild Health when defending from a player. OA: Chance to Decrease opponent's Officer Attack by 15% when hit
Tiza,5.0,4.5,4.5,Do not bother with this officer,Tiza,,,,CM: Decrease Eclipse hostile's Shield Mitigation for the first round OA: Chance to increase mitigation by 100% against Eclipse hostiles
Toli,0.0,0.0,0.0,Below Deck: Increases warp speed; Officer: Decreases Armada and Invading Entities mitigation by percentage of officer Defense.,Toli,,,,BDA: Increases base Warp Speed OA: Decreases all Armada and Invading Entities base mitigation stats by % of Officer Defense every round (Cumulative)
Tom Paris,2.5,2.0,2.0,Below Deck: Increase mitigation stats against non-player hostiles and armadas at the start of battle by % of Defense; Officer: Increases Critical Damage for 1 round when hit by non-player hostile or armada.,Tom Paris,,,,"BDA: At the start of combat against a non-player hostile or Armadas, increase your Armor, Shield Deflection and Dodge by a % of Defence OA: When you take damage from a non-player hostile or armada, Increase Critical Hit Damage for 1 round (cumulative)"
Tomalak,4.5,3.5,4.0,Captain: tiny boost to penetration stats for cloaked ships; Officer: Second Anti-Klingon Officer - only use when maxed,Tomalak,,,,CM: Increase Penetration while cloaked OA: Increase Weapon Damage against Klingon targets by % of crew attack
TOS Chekov,3.5,3.0,3.0,"Limited use officer, TC takeover limited",TOS Chekov,,,,"CM: Increase the Impulse Speed of Explorers OA: When attacked on a Capture or Mining node, Decrease Opponents damage."
TOS Kirk,1.0,2.0,1.5,"Captain: stacking energy damage buff, depends heavily on your DEFENSE stats; Officer: second best Moral source",TOS Kirk,Morale,Y,Y,"CM: Increase Energy damage by Officer defence, per round cumulative when ship has Morale OA: Chance to give Morale at the start of the round if ship health is above 30% of stating value"
TOS McCoy,3.0,2.5,2.5,Both abilities are not Morale triggered and a straight addition to stats,TOS McCoy,,,,CM: Increase Mitigation by % of the crew's Health when defending OA: Increase All Stats of All Officers when on an Explorer
TOS Scotty,2.5,4.0,3.0,"Interesting help on warp range on explorers only, otherwise limited in use... one side of double bar synergy and max rank cadet scotty gives the largest boost to warp range.",TOS Scotty,,,,CM: Increase Warp Range of Explorers OA: Increase Repair Cost Efficiency
TOS Spock,3.0,3.5,3.0,"Captain: terrible shield restore (base defense only!); Officer: a PvP version of Gaila, maybe usefull at max Rank.",TOS Spock,Morale,,Y,CM: Increase of Defence to SHP of all ships in fleet (Base defence only) OA: Decrease opponent player's Critical Damage when ship has Morale
TOS Sulu,2.5,2.5,2.5,Crit boost upto 15% (max tier) is a respectable value to help trigger crits (is not cumulative),TOS Sulu,Morale,Y,Y,CM: Chance to inspire Morale for 1 round OA: Increase Critical Hit Chance each round when on an Explorer that has Morale
TOS Uhura,1.5,1.5,1.5,Captain: preventing critical against you (PvP only); Officer: getting more damage through the shields (PvP only),TOS Uhura,Morale,,Y,CM: Decrease opponent player's Critical hit chance if ship has Morale OA: Decrease opponent player's shield Mitigation if ship has Morale
Trip Tucker,2.0,2.0,2.0,Below Deck: Increase loot from Hirogen and Species 8472; Officer: Reduces opponents Crit Damage when you take damage.,Trip Tucker,,,,"BDA: Increases resources dropped from Hirogen and Species 8472 OA: Decreases opponent's Critical Damage when you take damage from a hostile or another player. (Once per weapon. Can stack, does not trigger in Aarmadas or Assaults)."
Tuvok,1.0,2.0,1.5,Below Deck: Increases Voyager's MAx Cargo; Officer: Increases the amount of Artifact Tokens gained from Formation Armadas,Tuvok,,,,BDA: Increases Voyager's Max Cargo Capacity OA: Increases the amount of Artifact Tokens gained from Formation Armadas
Two Of Eleven,1.0,1.5,1.0,Captain: Only the 2nd officer that increases Cargo Capacity; Officer: Good 3* and 4* mining boost!,Two Of Eleven,,,,CM: Increase Cargo Size OA: Increase to G3 and G4 Mining speed
Tyler,1.0,1.5,1.0,Captain: Capture Node only; Officer: probably one of the best Damage booster in game,Tyler,Burning,,Y,CM: Increase all officers Attack when the ship defends a Capture Node OA: Increase damage by % of crew's Attack when opponent's ship is Burning
Uhura,3.5,2.5,3.0,Captain: one time use only; Officer: low base value increase,Uhura,,,,CM: Chance to delay opponent's fire by 1 round when own shield is deleted OA: Increase ship's Accuracy
Vartoq,5.0,5.0,5.0,Do not bother with this officer,Vartoq,,,,CM: Increase Weapon Damage of Interceptors against Players OA: Increase Kinetic Weapon Damage against other player's ships
Vel,5.0,5.0,5.0,Do not bother with this officer,Vel,,,,CM: Increase Dilithium rewards from Hostiles OA: Increase Kinetic Damage against Hostiles
Vella,5.0,5.0,5.0,Do not bother with this officer,Vella,,,,CM: Increase Damage against Explorers OA: Increase Health of all Officers on the ship
Vemet,1.5,3.0,2.0,Captain: respawns your ship up to 3 times; Officer: Combine with Georgiou to remove every single round,Vemet,Burning,,Y,CM: Resurrect with % Hull Health OA: Decrease Shield Health of a Burning opponent by % of crew's Health
Vixis,4.5,4.5,4.5,Do not bother with this officer,Vixis,,,,"CM: Chance to delay opponent's Weapons each round, for 1 round OA: Decrease Energy Damage from players"
Wesley Crusher,3.5,3.5,3.5,Captain: +damage (vs. everything) increase applies once!; Officer: Self stat boost - Bug - Does not work at all,Wesley Crusher,,,,CM: Increase Damage against Hostiles and Armadas OA: Increases own stats
Weyoun,1.0,2.5,1.5,Captain: 100% chance of morale with full synergy in PvP when on an Explorer; Increase weapon shots in PvP when on an Explorer.,Weyoun,Morale,Y,Y,"CM: On round start, chance to apply Morale for 3 rounds when fighting against a player, if on an Explorer OA: Increases Weapon Shots at the start of each round, for 2 rounds, when fighting players and on an Explorer with Morale"
William T. Riker,1.0,3.5,2.0,Captain: Cumulative damage to armadas; Officer: Increase to damage against Federation Hostiles and Armadas,William T. Riker,,,,CM: Increases Weapon Damage against Armada Targets (Cumulative) OA: Increases Damage against Federation Hostiles and Armadas
Worf,4.0,4.5,4.0,"Captain: Limited use; Officer: Not as strong as Beverly, similar to Moreau but increases your mitigation, rather than decreasing hostile's penetration.",Worf,,,,"CM: After winning a battle, Worf increases the Warp Speed of the ship. This bonus does not stack, and is removed when returning to your station. OA: Increases all Mitigation stats against non-player targets"
Woteln,5.0,5.0,5.0,Captain: very small damage increase; Officer: very small Dodge increase,Woteln,,,,CM: Increase damage if opponent's ship is a Battleship OA: Increase dodge when aboard an Interceptor
Yan'Agh,4.0,3.0,3.5,Captain: do not bother; Officer: get him to max before use,Yan'Agh,,,,CM: Increase damage after depleting the opponent's Shield Health OA: Increase Damage to Romulans by % of crew's Health
Yuki,2.0,1.0,1.5,Captain: the best shield removel ability in game; Officer: anti romulan damage - get her to max,Yuki,,,,CM: Decrease the shield Health of the opponent's ship each round OA: Increase Damage to Romulans by % of crew's Health
Zahra,5.0,5.0,5.0,Do not bother with this officer,Zahra,,,,CM: Increase ships Hull Health when defending a station OA: Increase Damage dealt when defending a Station
Zhou,3.5,2.0,2.5,"Officer: increases your Defense Mitigation with Defense - perfect fit with Kirk + Spock, max him quickly!",Zhou,Morale,,Y,CM: Increase Defence of bridge officers OA: Increase Mitigation by % of crew's Defence when having Morale
,,,,,,,,,
